{
  "pack_id": "LOT_TRACEABILITY_MEDICAL",
  "name": "Medical Lot Traceability",
  "industry_profiles": ["medical"],
  "description": "Lot-based traceability requirements for medical devices",
  "references": ["FDA_21_CFR_820.65", "ISO_13485_7.5.9"],
  "rules": [
    {
      "rule_id": "MEDICAL.TRACEABILITY.LOT",
      "pack_id": "LOT_TRACEABILITY_MEDICAL",
      "applies": {
        "industry_profiles": ["medical"]
      },
      "target": {
        "object_type": "document",
        "selector": {
          "doc_type": "LOT_TRACEABILITY"
        }
      },
      "when": {
        "field": "industry_profile",
        "operator": "equals",
        "value": "medical"
      },
      "then": {
        "action": "REQUIRE",
        "enforcement": "BLOCK_RELEASE",
        "payload": {
          "doc_type": "LOT_TRACEABILITY",
          "object_id": "LOT_TRACE",
          "traceability_depth": "lot_based"
        }
      },
      "why": {
        "summary": "Lot-based traceability required for medical devices per FDA QSR 820.65",
        "citations": ["FDA_21_CFR_820.65", "ISO_13485_7.5.9"]
      },
      "metadata": {
        "severity": "critical",
        "tags": ["traceability", "lot", "medical"],
        "version": "1.0.0"
      }
    }
  ]
}
